"cluster","cell_cluster","#cells","up_or_down","#genes","genes"
"1","0","327","down","176","Psd, Calm1, Tmsb4x, Chn1, Arf3, Ttr, Rnu5g, Enc1, Nrgn, Enpp2, Nptx1, Slc1a2, Calm2, Snap25, Rn7s1, Kalrn, Camk2a, Gm26035, Gm25106, Gm26461, Gm24447, Cck, Gpm6a, mt-Rnr2, Ctxn1, Actb, Dgkz, Gm23624, Rnu2-10, Slc17a7, mt-Rnr1, Olfm1, Calm3, Snca, Rn7s2, Ppp3r1, Ptk2b, Igfbp4, Mef2c, Zbtb18, Camk2n1, Cyfip2, Egr1, Rasgef1a, Prkcb, Adcy1, Baiap2, Crym, Sncb, Ptgds, Diras2, Gm23287, Epn1, Slc39a10, Fmnl1, Nptxr, Rtn1, Pgm2l1, Cplx2, Ddn, Atp1a1, Sparc, Camkk2, Neurod6, Plk2, Phf24, Tcf4, Fam131a, Pip5k1c, Sptbn2, mt-Tm, Synpo, Dnm1, Gria2, Mmp17, Homer1, Mmd, Fkbp1a, 3110035E14Rik, Strn4, Mpped1, Icam5, Itpka, Mkl2, Fam163b, Psd3, Syt1, Prkcd, Sipa1l1, Snap91, Stx1a, Cnih2, Slc17a6, Mbp, Foxg1, Gda, Camta2, Stxbp1, Syn1, Atp6v1g2, Hpcal4, Wasf1, Cacng3, Adgrb2, Pcp4, Neurod2, Ptms, Plcb1, Mt3, Sv2b, Pcp4l1, Cpne6, Fxyd7, Dkk3, Kcnip2, Plp1, Hpca, Phyhip, Mapk10, Pde1a, Klhl2, Grin2a, Grin1, Efhd2, Serpini1, Rock2, Itpr1, Rnf187, Pld3, Celf5, Ttc9b, Mobp, Mapk1, Gm20594, Arpp19, Scn1b, Fbxl16, Khdrbs3, Camkv, Ube2ql1, Git1, Ncald, Prkar1b, Arpp21, Gm24105, Gm22513, 1110008P14Rik, Gm42418, Trf, Zic1, Adarb1, Pmch, Ntng1, Resp18, Mag, Apod, Tcf7l2, Amotl1, Qdpr, Car2, Rn18s-rs5, Plcb4, Mal, Plekhb1, Tnnt1, Lars2, Rora, Agt, Slc6a11, Gm24265, Cnp, Cldn11, Nefh, Shox2, Ptpn4, Gatm"
"2","1","315","up","4","Rnu5g, Gm24447, Rn7s1, Gm26461"
"3","1","315","down","143","mt-Rnr1, mt-Rnr2, Gm25106, Gm26035, Gm28661, Rnu2-10, Gm23624, Gm23287, Rn7s2, mt-Nd1, Gm13341, Gm20594, mt-Co2, mt-Tm, Gm23971, Actb, Gm22513, Cpe, Aplp1, Gm26316, Gm23345, Calm3, Gm24105, mt-Nd5, Mt3, Sncb, mt-Nd6, Scd2, Uba52, Gm6272, Gm22739, Gm24265, Gm22614, Sparcl1, Aldoc, Skp1a, Aldoa, Gm1821, Ywhaz, Gm23153, Tmsb4x, Gm25890, Tmsb10, Rps29, Kif1a, Smarcc2, Spock2, Rn7sk, Pcsk1n, Gm24146, Slc6a17, Snap25, Snap91, Gm24407, Adprh, Myl12b, Hsp90ab1, Ndufa4, Sptbn1, Prdx1, Chchd10, Rnf187, Spock1, Cnp, Stxbp1, Gm10736, Lmo4, Ptma, Gm7079, Ociad1, Cldn11, Mt2, Bzw1, Cyp46a1, Mprip, Arf3, Kif21a, Plp1, Qk, Scg5, Gng3, Olig1, Bex2, Srrm2, Apoe, Cntn1, Got1, mt-Tw, Coa3, Ghitm, Cplx1, Ubc, Abca2, Lpgat1, Rab6b, Cryab, Apod, Sept7, Snrpn, Dynlrb1, Gm15459, Atxn10, Slc6a11, Prdx6, Desi1, Arl8a, Rps5, Eno1, Mff, Mapk10, Syn1, Cck, Hapln4, Hepacam, S100b, Slc24a2, Mapre3, Tubb4a, Pacsin1, Car2, Gstm1, Rps10-ps2, Gatm, Hcn2, Elmo1, Trnp1, Pacs2, Sez6l2, Sept4, Qdpr, Gm26723, Spock3, Ndrg1, Malat1, Mobp, Plekhb1, Hbb-bs, Mal, Mbp, Nefh, Trf, Hbb-bt, Prrc2a"
"4","2","176","up","7","Plp1, Enpp2, Ttr, Gm42418, Lars2, Rn18s-rs5, Pmch"
"5","2","176","down","326","Camk2n1, Nrgn, Cck, Olfm1, Camk2a, Chn1, Enc1, Snap25, Calm1, Mef2c, Ppp3ca, Rasgrp1, Trf, Slc17a7, Gm13341, Cldn11, Lingo1, Cnp, Ptk2b, Syt1, Scd2, Mobp, mt-Rnr1, Mbp, Apod, Fth1, Atp2b1, Dlgap3, Adcy1, Gm26917, Zfp365, Arpp21, Rbfox1, Car2, Prkcb, Calm2, Wasf1, Ddn, Nsmf, AI593442, Resp18, mt-Co2, Gpx3, Sptbn2, Six3, Mal, Fam131a, Qdpr, Dbi, mt-Nd6, 3110035E14Rik, Eef1a1, Vamp2, Lmo4, Cryab, Dgkz, Ndrg3, Stx1a, Rgs4, Tbr1, mt-Rnr2, Gria2, Zbtb18, Nnat, Malat1, Phf24, Scn1b, Gpm6a, Qk, Selenop, Csrp1, Ndrg1, Dlgap1, Syt7, Pla2g16, Adgrb2, Fbxl16, Prkcg, Fkbp1a, Kalrn, Ahi1, Psd3, Ermn, Sv2b, Vat1l, 2010300C02Rik, Ncdn, Cnih2, Ppp1r9b, Slc39a10, Gabra4, Tiam1, Tcf4, Camk1d, Sema7a, Mag, Stum, Nrxn1, Kcnf1, Tpt1, AW551984, Plppr4, Scn8a, Tppp3, Aplp1, Mir6236, Khdrbs3, Fbxw7, Psd, Cabp1, Plekhb1, Egr1, Itpr1, Mapk1, Rps15, Baiap2, Hivep2, Gatm, Dnm1, Gm26723, Nptxr, Icam5, Cyfip2, Homer1, Ttc9b, Nptx1, Ppp3r1, Lmtk2, Fam19a2, Rnf112, Dnajb5, Nell2, Itpka, Gm25106, Cadm2, Apoe, Nrn1, Nme7, Igfbp4, Mpped1, Shank3, Unc13a, Clstn1, Rasgef1a, Kcnc2, Mgll, Neurod2, Gm24447, Mical2, Diras2, Lamp5, Slc30a3, Olig1, Snph, Rbfox3, Pgm2l1, Grin2a, Cnksr2, Sprn, Scn2a, Cpne6, Grin2b, Gabbr2, Snca, Mal2, Cap2, Abat, Prdx1, Sirpa, Arf3, Ttyh2, Synpo, Cx3cl1, Tuba4a, Mgst3, Cacnb4, Cul4b, Sipa1l1, Anln, Rps12, Crmp1, Rnu2-10, Brinp1, Anks1b, Mmd, Plppr2, Mir6240, Neat1, Mog, Scrt1, Gaa, Pip5k1c, Dagla, Rps11, Calml4, Sparc, Camk4, Hpca, Cplx1, Nov, Gng11, Ptpn3, Srpk2, Ugt8a, Rtn4rl1, Kifc2, Abhd17a, Mmp17, Rnu5g, Epha4, Wipf3, Gm6272, Tulp4, Efhd2, Ociad2, Agt, Atp6ap2, Slc25a22, Slc12a2, RP23-70B19.5, Bcas1, S100b, Tmem88b, Calb2, Kcne2, Peg3, Pkp4, Wdr6, Abca2, Tmem255a, Sox2ot, Hapln2, 1110008P14Rik, Trpm3, Slain1, Ndn, Kif5b, Gm12346, Pacs2, Clic6, Baiap3, Sirt2, Pdp1, Sept4, Rhog, Ywhaq, Tprn, Tubb4a, Lbh, Ramp3, Efnb3, Gprc5b, Adipor2, Nap1l5, Psat1, Wscd1, Gjc3, Ptgds, Lamp1, Zbtb20, Rps27l, Tac1, Tpt1-ps6, Htr2c, Prlr, Wnk1, Frmd8, Rnf13, Gprasp2, Tspan5, Gad2, Gpr37, Tspan2, C4a, Tmem130, Nova1, Evi2a, Cartpt, Fbn1, Rps15-ps2, Ppp1r14a, Fam212a, Gm24245, Sowahc, Capns1, Ptpn4, Hap1, Bex1, Rit2, Lamp2, Mid1ip1, Ap1s2, 2310022B05Rik, B630019K06Rik, Rimbp3, Sostdc1, Impact, Gna12, Myrf, Cntn2, Gcn1l1, Gnai2, Prkcd, Cox8b, Tmsb10, Gsn, Nrsn2, Cygb, Picalm, Scg2, Fa2h, Itgb4, S100a16, Kl, Slc38a3, Hdac11, Gm24270, Cab39l, Gm15564, Slc25a39, Msi2, Phldb1, Igfbp2, Szrd1, Zcchc12, Ezr"
"6","3","91","up","16","Prkcd, Pcp4, Shox2, Tcf7l2, Ptpn4, Ramp3, Adarb1, Ntng1, Slc6a11, Slc17a6, Pdp1, Rora, Zic1, Gabra4, Ptpn3, Nefh"
"7","3","91","down","702","Atp2a2, Nrgn, Plekhg1, Tnnt1, Nsmf, Kcnc2, Amotl1, Plcb4, Rgs4, Nrip3, Synpo2, Ndrg4, Cpe, Cplx1, Hcn4, Atp1a2, Grm1, Rgs16, Lef1, Abhd12b, mt-Rnr2, Uchl1, Eps8l2, Elmo1, Gm42418, Spock2, Spock1, Ccdc136, Rab37, Rab3c, Trnp1, Ttr, Spock3, Cpne9, Kcnj10, Gm43398, mt-Rnr1, Gabrd, Vav3, Rap1gds1, Edil3, Tmem163, Sptbn1, Olfm1, Gm26461, Vamp1, Sh3d19, Atp6ap2, Psd, Zmat4, Patj, Rn7s1, Xylt2, Slc24a2, Cit, Gpr153, Gpm6a, Pcp4l1, Ppp3ca, Dlgap3, Ttll7, Kndc1, Slc24a3, Ildr2, Rgs8, Kitl, St3gal4, Rap1gap, Aldoc, Shank3, F2r, Sparc, Aplp2, Nrxn3, Tespa1, Nell1, Cacng5, Zfp423, Slc6a17, Sparcl1, Opn3, Gabbr2, Tpd52l1, 1810041L15Rik, Pitpnc1, Ywhaz, Aldh1a1, Reep2, Inpp5a, Ldhb, Atp1b1, Atp2b1, Ids, Clmn, Hspa12a, Snap25, Atp1b2, Plp1, Hpcal4, Rtn1, Hlf, Ly6h, Ctnnb1, Mbp, Enah, Gm24447, Cplx2, Lmo4, Nrxn1, Rasd1, Ndrg2, Lhfp, Gad1, Tmem131, AI593442, Prkch, Baiap2, 6330403K07Rik, Srgap1, Rims3, Camk2n1, 3110035E14Rik, Serpini1, Cdk5r1, Celf4, Serpine2, Cck, Ngef, Cacna1g, Gm26035, Adra1b, Hpca, Ddn, Nacc2, Kcnc1, Gm20594, Mb21d2, Scrt1, Nov, Kif1a, Gpc1, Slc9a3r1, Rasgef1b, Rasgrf2, Snca, Rcan2, Chst8, Inpp5j, Camk2a, Hcn2, Syt9, Rps29, 1700019D03Rik, Tspan9, Sst, Mobp, Rnu5g, Rassf3, Tunar, Cst3, Pld3, Gm23624, Enho, Mgst3, Rsrc1, Tmsb10, Adcy8, Scd2, Ctxn1, Gnal, Apod, Slitrk6, Cpne7, Rasgrp1, Epb41l3, Gm24265, Lrrn2, Alcam, Creg1, Ahi1, Bok, Atp1a1, Gm10076, Egr1, Mapk1, Fryl, Rn18s-rs5, Rab6b, Snrpn, Tubb3, Pde1a, Osbpl5, Basp1, Dbndd1, Cnr1, Tusc3, Fem1c, Scd1, Tubb4a, Grm4, Kcnh3, Zfhx3, Tcf4, Gm25106, Ndufa4, Syt5, Ncdn, Adgra1, Ywhah, Fam20c, Ptprm, Tmem56, Gria2, Phactr1, Tiam1, Sgpp2, Cyp46a1, Foxg1, Camk2n2, Icam5, Lmo3, Rpl37, Rn7s2, Plekhb1, Ina, Aldoa, Rps5, Rnf152, 6430548M08Rik, Rps19, Pkia, Prdx2, Olig1, Adarb2, Nr2f1, Chn1, Rgs7bp, Lamp5, Atp5a1, Peak1, Mprip, Kcna2, Rplp1, Ttc9b, Gad2, Megf9, Paqr8, Fndc5, Enc1, Fbxo9, Sacm1l, L1cam, Slc25a5, Hmga1-rs1, Reps2, Tmem229a, Pgrmc1, Csdc2, Myo1b, Ipcef1, Stx1a, Gda, Cabp1, Anxa5, Mturn, Gm24407, Fbxl16, Slc29a1, Aatk, Map1a, Nrsn2, Itm2c, Hrh3, Rps2, Arhgap44, Epb41l1, Atp5b, Neurod2, Chchd10, Desi1, Lrrtm1, Ptprj, Pdhb, A830018L16Rik, Pvalb, mt-Tm, Ghitm, Rab11fip5, Chst1, Klhl2, Gatm, Atpaf1, Syt7, Rnu2-10, Marcks, Adprh, Gm16238, Gabbr1, Nmnat2, Sowaha, Rps16, Sncb, Caln1, Tcf25, Penk, Gm22122, Lrtm2, Fndc4, Dlgap1, Clec2l, Gm22513, Chrna4, Prox1, Tanc1, Sept4, Wbscr17, Bzw1, Lynx1, Gpr37l1, Samd5, Prkca, Nptn, Srpk2, Gm10073, Acot7, Ppp2r5d, Fxyd6, Mlf2, Cd47, Gm1821, Neurl1a, Lhx2, Golga7b, Pnmal2, Atp2b2, Stum, Hap1, Qdpr, Unc5a, Car2, Prnp, Pkm, Got1, Arl4c, Synpr, Herpud1, Clvs1, Nptx1, Hspa4l, Ppp1r9a, Rpl22l1, Enpp2, Cnp, Syt16, Syt13, Gm23287, Epha4, Gm14630, Fam131a, Gabrb3, Cntn1, Ckmt1, Neurod6, Abca2, Necab2, Ndufa10, Rpl13, Fkbp1a, Cadm4, Rps26, Reep1, Gm14303, Kcnd3, Rasgef1a, Hspa8, Rpl41, G6pdx, Jph4, Cadm1, Crym, Rusc1, Selenot, Itih3, 2010300C02Rik, Gm24105, Slc38a2, Fign, Rprm, Scg5, Dennd5a, Setd7, Homer1, Itpka, Kcnq3, Pkig, Ergic1, Eef1a2, Zyx, Syn2, Acsbg1, Sipa1l1, Mef2a, Mmp17, Synpo, Crim1, Prkacb, Ndufa12, Prdm8, Acsl3, Lypd1, Cend1, Hopx, Map2k1, Ociad1, Ryr2, Nat8l, Cldn12, Kcnj4, Gm12251, Impa1, Dclk2, Bhlhe22, Thra, Pepd, Fgfr3, Snap91, Rps15, Nhsl2, Glud1, Doc2a, Stmn3, Kcnip2, Cttnbp2, Rimkla, Dkk3, Nfasc, Ndufb8, S100b, Uqcrc1, Mapre3, Meg3, Ndn, Ldb2, Gdpd5, Eno2, B4galt5, Plxdc1, Fam189a2, Grm5, Becn1, Hpcal1, Atp2b4, Rit2, Napepld, Rpl19-ps9, Sema7a, Sept6, Slc32a1, Pcsk2, Slc30a3, Apoe, Fam212b, Trap1, Clip3, Gng3, RP23-464F18.3, Gm15427, Gm17511, Avpi1, Rab11a, Phyhip, Rpl37a, Hcn1, Syngr1, Irs2, Ociad2, Pdzd8, Slc38a1, Agtpbp1, Rps18, Synj2, Rpsa-ps9, Adgrb1, Src, Rpl19, Glo1, Ldha, mt-Nd6, Sphkap, Nsg1, Ogfrl1, Rab4a, Rps16-ps2, Ndufs7, Esrra, Gjb6, Vstm2l, Fam81a, Mef2d, Slc17a7, Anks1b, Unc13c, Pla2g7, Scn2b, Paqr7, Rorb, Rab3b, Gtf2i, C1qtnf4, Secisbp2l, Mgat5, Gpi1, Syp, Efr3b, Plk2, Zdhhc5, Rps14, Elavl2, Mast3, Pitpna, Vdac1, Lin7c, Tsc22d3, Rpl17, Mical2, Ak5, Mag, Adcy2, Agt, Slc4a4, Pcdh9, Pgk1, Cdkl5, Tbr1, Scn4b, Gm26723, Nptxr, Cacng4, Mpped1, Galnt9, Gm10443, Btbd11, Gm7285, Qk, Cd200, Tmbim1, Rps10, Kcnip4, Gm12254, Sash1, Ets2, Rusc2, Nt5dc3, Gucy1a3, Kcnj9, Osbpl2, Aes, Dclk1, Cadps, Tspan3, Vstm2a, Sirpa, Atp5d, Dynlt3, Tmem160, Fam134b, Ndufs4, Mmd, Stoml2, Scn1b, Gm9493, Plekha6, Ttc7b, Cpne6, Rps24-ps3, Mir6236, Kalrn, Hs3st4, Olfm3, Satb1, Gas7, Slc8a2, Lgi3, Gucy1b3, Rps9, Map2, Palm, Arhgap33, Rapgef4, Arpp21, Rhob, Asap2, Cox5a, St6galnac5, Tmem9b, Mast2, Usp22, Rpl7, Ncs1, Rgl1, Gria1, Fam8a1, Stxbp5, Selenom, Rnf112, Gprin1, Cntn4, Plppr4, Agpat3, Atp5g1, Dexi, Slc1a3, Slc12a5, 1500015O10Rik, Mkl2, Car7, Sdc3, Ifi27, Cited2, Scn1a, Map4, Mef2c, Chrm1, Gm4332, Svop, Etnppl, Arl2, Prkcb, Lars2, Fam168a, Fbxo44, Pitpnm2, Rpl31-ps17, Rpl18a, Gm15536, Srgap2, Kcnk1, Coa3, Sh3bgrl3, Rhou, Nap1l1, Kcnab1, Cnksr2, Dmtn, Zbtb18, Gars, Fam163b, Kcnq5, Rab15, Fam19a5, Rell2, Ccdc92, Gm15920, Atf4, Gfap, Gm15564, Apbb2, Scn3b, Ap2b1, Trp53i11, Gprc5b, Idh3a, Ddah1, Epop, Kcnab2, Cacnb3, Atxn1, Fam219a, Ptpn5, Pmch, Fscn1, Mpc2, Slc12a2, Iqsec2, Nefm, Pacsin1, Hspd1, Dnm3, Gm26917, Oxct1, Kif3c, Tmem256, Igf2, Trem2, Clasp2, Ptk2b, Kcnj3, Sptbn2, Cygb, Lypla2, Ankrd17, Hexb, B230334C09Rik, Pnck, Dnm1l, Tmem132a, Tac1, Ptgds, Nnat, Tubg1, Sec11c, Adgrb2"
