"cluster","cell_cluster","#cells","up_or_down","#genes","genes"
"1","0","316","down","49","Gm26035, Gm24447, Supt7l, Rnu5g, Sez6, Rn7s1, Gm26461, Pip5k1a, Lrrc17, Gm23624, S1pr1, Kif15, Gm25106, Olfm1, mt-Tm, Gm24265, 2810433D01Rik, Gm13339, Aldoc, Sparcl1, Gm22122, Gm15728, Kif3a, Slc1a2, 4930426I24Rik, mt-Tf, Ccni, Gm45212, Ptk2b, mt-Ta, Zbtb20, mt-Nd6, Malat1, Gstm1, Qk, S100b, Plp1, Mir6236, Cryab, Plekhb1, Cldn11, Slc6a11, Cnp, Lars2, Tcf7l2, Gm26917, Mobp, Apod, Mbp"
"2","1","227","up","1","Plp1"
"3","1","227","down","249","Mbp, Olfm1, Mobp, Camk2a, Nrgn, Sparc, Cnp, Camk2n1, Slc6a11, Mal, Apod, Plekhb1, Nptxr, Cldn11, Mef2c, Chn1, Scd2, Qdpr, Trf, Fth1, Ptk2b, Gpm6a, Enc1, Slc17a7, Tmsb4x, Qk, Ppp3ca, Cryab, Atp1a2, Gda, Ndrg2, Arf3, Hpcal4, Atp1a1, Gatm, Bcas1, Calm2, Nptx1, Mag, Kalrn, Mapk1, Fam131a, Sv2b, Selenop, Zfp365, Psd, mt-Tm, 2010300C02Rik, Baiap2, Agt, Pld3, Gria2, Homer1, Cck, Syt1, Sptbn2, Csrp1, Kcnj10, Wasf1, Dgkz, Itpr1, Tcf7l2, Ppp3r1, Ctxn1, Ddn, Ndrg1, Ttc9b, Olig1, Mog, Tspan2, Apoe, Snca, Sept4, Aldoc, Ermn, Fbxl16, Egr1, Psd3, Cx3cl1, Icam5, S100b, Foxg1, Arpp19, Zfhx3, Pllp, Tmem88b, Celf5, Prkcb, Supt7l, Stx1a, Arpp21, Plk2, Lingo1, Cnksr2, Lrrc17, Plppr4, Zbtb18, Gm26461, Ier5, Kctd1, Gm24265, Mpped1, Pacs2, Rab40b, Sipa1l1, Nrn1, Mmp17, Car2, Atp1b2, Sez6, Gjc3, Chst1, Ppp1r14a, Nov, Mical2, Vamp2, Pip5k1a, Itpka, Myrf, Rasgef1a, Gabrb3, Fnbp1, Syn2, Pde1a, Efhd2, Scd1, Neurod2, Ngef, Dkk3, Ttyh2, Tubb4a, Plcb1, Il33, Fbxw7, Sst, Serpine2, 3110035E14Rik, Prr18, Tbr1, 5031439G07Rik, Ensa, Kcnf1, Slc17a6, Kcnv1, Grin2a, Hpca, Tmem178, Shisa7, Cplx2, Golga7b, Fam81a, Peg3, Chrm1, Phyhip, Rhog, Pip5k1c, Cap2, Mkl2, Ano3, Bhlhe22, Camk4, Pcsk2, Nacc2, Serpini1, Adcy1, Cacng3, Lamp5, Fam49a, Epop, Slc12a2, Arhgap33, S100a16, Gpr37l1, Ipcef1, Rn7s1, Gpr37, Fa2h, Eid1, Mid1ip1, Fkbp1a, Kcnip2, Rnf13, Dusp14, Acsbg1, Rock2, Fbxo41, Gm24447, Ugt8a, Desi1, Kcnh3, Slc6a9, Kif15, Gm26035, Edil3, Dynll1, Slc44a1, Crym, Gna12, Npy, Ncald, Snph, R3hdm2, Scn1b, Ptms, 1700020I14Rik, Carhsp1, Vip, Mal2, Gucy1b3, Sirt2, 1110008P14Rik, Plcb4, Atp2b4, Nrsn2, Psat1, Resp18, Sorbs2, Ndn, Neat1, Ap1s1, Fndc5, Kcnip3, Cpne6, Ccdc136, Tmem229a, Erbin, Prkcd, Gm15728, Cnih2, Hcn2, 2810433D01Rik, Lgi3, Vamp1, S1pr1, Kif3a, Amotl1, Nefh, Abca2, Nap1l5, Zic1, Ahi1, Rora, Adarb1, Ptgds, Calb2, Ramp3, Ctxn3, Hba-a2, Hba-a1"
"4","2","162","down","57","Camk2a, Slc1a2, Nptxr, Sez6, Cnih2, Arf3, Supt7l, Pip5k1a, mt-Tn, Gm26035, Ddn, S1pr1, Kif15, Slc1a3, Gm24447, 2810433D01Rik, Lrrc17, Kif3a, mt-Tl2, Mbp, Mobp, Hpcal4, mt-Th, Nnat, Cnp, Bhlhe22, Syn2, Rasgef1a, mt-Tp, Trf, Nov, Mal, Map2, Sept4, Synpr, Rcan2, Gda, Gm15728, Plp1, Rn7s1, Hpcal1, Bend6, Cryab, Slc17a6, Crym, Lypd1, Necab2, Qdpr, Plcb4, Gm26461, Enpp2, Ptgds, Apod, Mag, Cldn11, Gm42418, Prkcd"
"5","3","154","down","200","Ttr, Prkcb, mt-Rnr2, Snap25, Ptgds, Nrgn, Cck, Sparc, Enpp2, Calm1, mt-Rnr1, Kalrn, Syn1, Sncb, Itpr1, Calm2, Aldoa, Chn1, Dclk1, Egr1, 1110008P14Rik, Stxbp1, Dlgap1, Mef2c, Diras2, Rab6b, Calm3, Nnat, Pip5k1c, Psd, Homer1, Mapk10, Satb2, Arpp19, Syt1, Atp2b2, Ier5, Slc17a7, Pcsk2, Osbpl1a, Sv2b, Pgm2l1, Efhd2, Cst3, Camk2n1, Cyfip2, Vsnl1, Camkk2, R3hdm2, Dkk3, Slc12a5, Kcnb1, Stx1a, Ywhaz, Adcy1, Malat1, Cdk5r1, Atp2b1, Gria2, Fkbp1a, 3110035E14Rik, Arhgap32, Ttc9b, Arf3, Trf, Scg5, Rock2, Rn7s1, Fxyd7, Nr4a1, Stmn1, Cdkl5, Cx3cl1, Sptbn2, Rab6a, Mbp, Ppp3ca, Asap1, Ptms, Rasgrp1, Igf2, Epop, Slc6a17, Atp1a1, Fmnl1, Gfra2, Hivep2, Trim9, Zfp365, Fam131a, Phf24, D430041D05Rik, Gm42418, Rimbp2, Cadm2, Olfm2, Pde1a, Mical2, Syngr1, Tmsb4x, Baiap2, Gm24447, Serpini1, Stac2, Sept3, Zcchc12, Sept8, Dusp6, Grin2a, Efnb3, Ubald1, Rph3a, Gm20594, Tbr1, Mgst3, 1700020I14Rik, Oxr1, Hba-a1, Dusp3, Lmo4, Fam163b, Satb1, Plk2, Ube2ql1, Ctxn1, Ccl27a, Fbxw7, Syp, Bsn, Gm26461, Pantr1, Grin1, Prkar1b, Gls, Mpped1, Lingo1, Cacnb4, Tmsb10, Lpgat1, Sh3gl2, Mmp17, Necab2, Agt, Gm26035, Hbb-bs, Cplx1, Enc1, Usmg5, Sema7a, Apod, Dgkz, Lamp5, Cacng3, Foxg1, Mtcl1, Hecw1, Gabrg2, Gm24265, Hap1, Efr3a, Cyp46a1, Galnt9, Scn1b, Car2, Nptx1, Slc6a11, Rn18s-rs5, Dbi, Selenop, Fam81a, Mal, Mobp, Neurod6, Plp1, Ahi1, Gda, Camk2g, Snca, Pcp4l1, Hbb-bt, Supt7l, Rgs4, Arc, Kcnab1, Igfbp4, Prkcd, Zic1, Calb2, Tcf7l2, Hba-a2, Gfap, Mag, Clic6, Cldn11, Lypd1, Cnp, Lars2, Cth, Npy, Gm26917"
"6","4","38","up","16","Gm42418, Rn18s-rs5, Lars2, Gm26917, Gm45212, Mir6236, Hbb-bs, Hba-a2, Hba-a1, Hbb-bt, Ttr, Igf2, Clic6, Enpp2, 1500015O10Rik, Kl"
"7","4","38","down","644","mt-Nd1, Mir6240, Rsph4a, Gm45396, Lbx1, Gm10925, Ppp3ca, Fbn1, Gm28661, BC001981, Rimbp3, mt-Co1, Fam212a, Sncb, Rtn1, Vwa3a, Calm2, mt-Co2, Celf2, Gm15564, AA474408, Atp1b1, Msx1, Calm1, Rab6b, Foxj1, Ank3, Gm29216, Ywhag, Otx2, Abca4, Ndrg4, Gm13340, Lrrc17, Dpysl2, Gng3, Rbm47, Vsnl1, Gm5869, Eef1a2, Fam84b, Calml4, Ace, Scn1b, Nrgn, Wdr86, Rsph1, Aldoa, Cachd1, Mon2, Sgk3, Gabra1, Thy1, Tspo, Olfm1, Ncdn, AI593442, Map1b, Supt7l, Cdkn1c, Stmn3, Atp2b1, Syt11, Trpm3, Gm13341, Camta1, Syt4, Snap25, Rtn3, Aplp1, Dynll2, Tmsb4x, Pcsk1n, Pgm2l1, Col8a2, Prr32, Col8a1, Uchl1, Cfap126, Pwwp2a, Pip5k1a, Sez6, Ppp1r1b, Vamp2, Stx1b, Ezr, Rnf187, Nrxn2, Sowahc, Nefl, Klc2, Sox9, Trpv4, Spock2, Cyfip2, mt-Tv, Sult4a1, Basp1, Msi2, Gm24245, Susd4, Clstn1, Nop9, Cab39l, Nrsn1, Cul4b, Cplx1, Grin2a, Fez1, Stxbp1, Slc4a2, Cend1, mt-Tf, Dnm1, Vgf, Celf4, Prkcb, Slc25a4, Sel1l, Camta2, Syt1, Gnao1, Tead1, Cox6b2, Cnih2, Ywhaz, Atp6v1b2, Gabbr2, Gm25911, Vamp8, Ybx1, mt-Atp6, Cx3cl1, Nsg1, Rbp1, Sh3d19, Rab6a, Ptpn5, Tubb2a, Elavl3, Gria2, Eno2, Napb, Plac9a, Fam46c, Atp2a2, Atp6v1g2, Frrs1l, Sptbn2, Dab2, Snhg11, Kif15, Tmem130, Tcf25, Rbfox1, Gabbr1, Camk2b, Igfbp2, Hapln4, Prcd, n-R5-8s1, Fkbp1a, Stmn1, Tmsb10, Pacsin1, Gm15800, Ache, mt-Tl1, Pcsk2, Kcne2, Serinc1, Mdfic, Gm13456, Cck, Enc1, Diras2, Ank2, Tmem72, Ywhab, Pak1, Tpi1, Grin1, Acaa2, Cox8b, Nat8l, Klc1, Hemk1, Opcml, Id3, Sostdc1, Kif1b, Lmtk3, Got1, Ube2ql1, Bex2, Cd59a, Prkce, mt-Te, Cxx1a, Folr1, Ap2a1, Ptk2b, Slc13a4, Tuba4a, Sars, Snrpn, Scn8a, Zfp36l1, Gpi1, Kcnc1, Psd, Fndc5, Tbcel, Ptprs, Calm3, Cd47, Chrm3, Pclo, Mlf2, Gpm6a, Glrb, Faim2, Ywhah, Meg3, Baiap2, Rdh5, Stk39, Gm24270, Pam, Atcay, Slc6a17, Prkar1b, Adcy1, Nrxn1, Cdip1, Cdk5r1, F5, Zbtb20, Ctnnal1, Car12, Selenow, Nsmf, Mef2a, Ccdc153, Ifi27, Vps8, Syngr1, Sh3bgrl, Gpx8, Atp6v0b, Gm9780, Wfdc2, Scrt1, mt-Ta, Gm24265, Cfl1, Snap47, Tspan7, Tnfrsf21, Galnt16, Slc6a1, Rusc2, Tns1, Nrip3, Mycbp2, Kif1a, Gabarapl1, Camk2n1, Syn1, Chst1, Grina, Dbi, Cnn3, Arhgap27, Pcp4l1, Adgrl1, Aqp1, Gabrg2, R3hdm1, Ndrg3, 2810433D01Rik, Nptn, Zwint, Kalrn, Txnl4a, Sntb2, Nsg2, Ucp2, Rock2, Pnmal1, Nrcam, Grin2b, Brinp1, S1pr1, Hras, Ina, Chn1, Dlgap1, Sirpa, Mllt11, Caly, Rab7, Acadl, Rapgefl1, Dnajc3, Ogfrl1, Edil3, Resp18, Vat1l, Tmem59l, Dbn1, Sez6l2, Reep1, Ndufb4, Camsap2, Gnai1, Cd9, Hp1bp3, Gria1, Cdkl5, Cadm4, Aldoc, Slc38a3, Mapre3, Sh3gl2, Fam189a1, Kcnj13, mt-Tp, Map1a, Phf24, Col9a3, Ncald, Prnp, Pja2, Hopx, Atp2b2, Tspyl4, Tmem212, Camkk2, mt-Tl2, Ttyh3, Cd24a, Lbp, Apbb1, Dact3, Ccnd3, Ppp3cb, Aatk, Sptan1, Adgrb2, Tpt1, Dmtn, Usp22, Kif5c, Cadps, Snap91, Nap1l5, Pak3, G3bp2, Gad1, Serbp1, Hsp90ab1, Pltp, Ap1s1, Clu, Syp, Unc80, Tgfb2, Zeb2, Coro1a, Rcan3, Prkacb, Bend6, Wrb, Strip1, B4gat1, Smarcd3, Gm15728, Rtcb, Kcna2, Gm26461, Abhd17a, Kifap3, Scamp5, Add2, Dgkz, Scg5, Gprasp1, Prelp, Mapk10, Rhob, Cdk14, Pgbd5, Tubb5, Sv2a, Egr1, Gm11512, Arhgef4, Tango2, Cdr2, Cdh2, Qdpr, Gm5575, Ensa, Prlr, Fam49a, Cdipt, Etfa, Tpt1-ps3, Nptx1, Npdc1, Aldh2, Reps2, S100a16, Slc12a5, Cd63, Lmo4, Cplx2, Serinc3, Podxl2, Cops8, Rab3c, Ndel1, Kcnj3, Ppp2r2b, Scn3b, Crym, Nrxn3, Npy, Fam189a2, Lingo1, Rcan2, Nefm, Atp5d, Nme7, Smyd2, Uqcrc1, Klhl2, Ndufb8, Ptprd, Ppp2r1a, Ephx1, Olfm2, Slc24a3, Kcnq2, Rrp1, Rtfdc1, Pip5k1c, Gm9800, Car14, Adora1, Sfpq, Cdc42bpa, Ppp3r1, Otub1, Fxyd1, Rangap1, Hipk1, Syn2, Nars, Aak1, Ndn, Pnmal2, Gm6170, Tspan5, mt-Tw, Lrrn2, Kif3a, Jph3, Nono, Emb, Ola1, C1qtnf4, Atrn, Ckmt1, Slc31a1, Dusp3, Ociad1, Arhgdig, Fam217b, Id4, Fam131a, Myh10, Nsf, Sez6l, Slc6a11, Gabrb3, Tbc1d9, Napa, Fkbp3, Rbms1, Sik3, Anks1b, Pcolce2, Dnajb5, Ndufv1, Add1, Nedd4, Gpr162, Dusp8, Tmem63b, Syt7, Clip3, Tprgl, Scn2a, Map1lc3b, Cacna2d1, Bag6, Emc10, Khdrbs3, Nlk, Akap6, Nbea, Rgs7, Epha4, Snx10, Tceal6, Nmnat2, Spint2, Tnk2, Cldn2, Sdr39u1, Kif5a, 6330403K07Rik, Nrsn2, Mbp, Myl12b, Nell2, Pde1b, Stmn4, Oxr1, Snhg14, Mprip, Aars, Cdk5r2, Mapk4, Vamp1, Cbarp, Mog, Cyp46a1, Adgrb1, Ptpra, Slco1c1, Tmem132a, Matk, Kcnj10, Mef2c, Rbfox3, 2210016L21Rik, Ap2b1, Map4, Hist1h1c, Mapk9, Tubb2b, Timp3, Cacng3, Cacna2d3, Pde4a, S100a1, Gad2, Gng5, Srcin1, Slc17a7, Ptov1, Evl, Spock3, Tmem151b, Ppfia2, Gpr37l1, Trnp1, Rarres2, Rbx1, Prkaca, Peg3, Zer1, Cd164, Fscn1, Tubb4a, Scg2, Arpp19, Ralyl, Ap2a2, Ahcyl2, Smpdl3a, Abhd2, Syngr3, Mrps6, Cald1, Cadm3, Kcnd2, Sept3, Mob1b, Hlf, Olig1, Cnr1, Fgf12, Snca, Rn7s1, Phactr2, Ift46, Rundc3a, Arfgef3, Slc4a3, Ap1s2, Rogdi, Elavl2, Slc29a4, Ggh, Serp2, Ftl1, Eef1a1, Rnf220, Vim, Camk2g, Selenom, Ubald1, Rph3a, Pvalb, Sulf1, Atxn7l3b, Cacnb4, Ptgds, Stk25, Celf5, Cacnb3, Cpne6, Itpka, Gas6, Rps27l, Sgk1, Vcam1, Dstn, Hist1h2bc, Elovl7, Car2, Eps8l2, Mobp, Arc, Efhd2, Rnf208, Mgp, Pcp4, 1110008P14Rik, Bin1"
