,cluster,#genes,genes
0,2,154,"hbae3, LOC100334599, si:ch211-5k11.12, krt4, otpa, LOC569335, cyt1, cyt1l, icn, gadd45gb.1, LOC797032, icn2, hbbe2, krt8, zgc:193505, LOC103911087, elavl4, fabp11a, acta1a, cldni, vim, krt5, hsp90aa1.1, fmoda, aldoab, myl10, ca2, lmo2, egr2b, cyp26b1, neurod1, otpb, slc45a2, sost, insm1b, insm1a, si:dkey-152p16.6, dlx1a, dla, LOC100538028, gsx1, prdm12b, pvalb8, postnb, ponzr5, zgc:109868, pmelb, wu:fc01d11, nansb, gsx2, dlx2a, onecutl, hfe2, id1, myl13, pmela, neurod4, tnnt2a, thbs4b, LOC563393, nhlh2, actb1, ednrab, atp2a1, eng2b, cplx2l, nexn, onecut1, gap43, neurog1, hand2, fabp7a, LOC100001360, sox18, tmsb, rgs2, nkx6.2, arpc1b, ctgfa, sparc, olig2, si:ch211-251b21.1, anxa1b, cbfa2t3, bmp5, lmx1ba, zgc:114181, eya2, nova2, cmyb, fli1a, si:dkey-12l12.1, gcm2, LOC103910930, flncb, mitfa, LOC101886860, wu:fb77a09, camk2d2, foxg1a, cldn5b, agrp, sox4b, stxbp1a, ucmaa, ntn1a, mab21l1, epha4a, nrn1a, nkx6.1, pou3f1, six1b, col15a1b, clu, cebpa, zgc:86896, isl1, bhlhe22, rab11bb, igfbp2a, LOC101882446, pax6b, vcana, atp1a3a, cthrc1a, six6b, zgc:110283, sox21a, zgc:158328, si:ch211-156j16.1, meis3, kpna2, ywhag2, stmn2b, dlx5a, ascl1b, rtn1a, LOC100536415, bmp10, si:dkey-85k7.7, meis2b, plk2b, ucp3, ak1, vcanb, col5a3a, scg3, isl2a, plod1a, mdkb, LOC103909023, ptgs2a, olig3, hoxc4a"
1,21,25,"hbbe1.1, dlb, rbfox1l, tyrp1b, spon1b, wu:fc46h12, ca15a, tmem88a, pcolcea, si:zfos-2330d3.3, b3gnt5a, nkx2.9, si:dkey-222f2.1, hmx3, LOC103909385, vamp2, eng2a, nkx2.5, fstl1a, gng3, hmx4, LOC100149066, si:ch211-255p10.3, tm6sf2, hoxc13a"
2,5,116,"hbbe3, elavl3, dct, LOC100003669, col1a1a, tmsb4x, hapln1a, mafba, fhl2a, gch2, tgfbi, scrt2, fosab, sox10, her2, LOC100534909, drgx, col1a1b, egfl7, her15.1, zgc:85866, cyp26c1, mdka, col11a1a, akr1b1, junbb, slc1a3a, col1a2, her12, her6, zgc:158291, atf3, tpm4a, pmp22a, bhlhe40, LOC103910167, LOC103908616, ascl1a, sox4a, zgc:162730, jag1a, prtga, tuba1c, her4.3, col2a1b, lrrn1, tuba1a, LOC798927, wu:fj16a03, uncx, h1f0, col4a5, zfp36l1a, eppk1, emp2, jun, si:ch211-67e16.11, cldn1, pitx3, si:ch211-201m7.3, LOC103911021, hmp19, slit2, foxn4, sp8a, dusp5, hmx3a, her9, ebf2, p4ha1b, kdrl, pax2a, alcama, h1fx, rpe65a, ndrg3a, cbx7a, sult2st1, fgfr3, serpinh1a, actn1, dkk3b, sdprb, lama5, zgc:77517, prdm16, actb2, crabp2a, klf6a, atp1a1a.4, sfrp2, nkx2.7, rps2, sulf2b, cd81a, oc90, matn4, epha7, rplp1, pbld2, hey1, igfbp1a, LOC103910332, angptl4, chac1, celf3a, LOC101885082, cnn2, junba, col7a1l, zbtb16a, tubb5, ankrd39, pleca, tfap2b, dag1"
3,16,32,"si:ch211-5k11.2, hbae1, krt91, anxa1c, aqp1a.1, vwde, mpeg1.1, ppm1j, foxa1, hist1h4l, cdh17, col9a3, igf2b, flt4, epb41b, hhex, fxyd2, LOC103912061, grem2, and1, tbcelb, LOC101886664, LOC101884537, LOC103911935, grem2b, LOC101884521, atp6v1c1b, LOC103910427, tmem8a, itpr3, LOC101886495, LOC101886690"
4,9,48,"MGC173646, mfap4, zgc:110712, zgc:173915, cfd, loxl5b, inab, zgc:110333, LOC100331195, LOC100005689, LOC100003868, LOC103909690, LOC101883507, LOC103909354, mmp24, si:ch211-202h22.9, ch25hl1.2, fgf20b, trpv6, LOC559461, crhbp, fam217b, LOC103909644, isg15, wu:fi38e05, oxgr1a.1, zgc:194930, si:ch211-210b2.1, zgc:194209, stxbp1b, zgc:194948, LOC101886714, LOC799039, LOC100535225, pax9, zgc:172122, LOC100330452, LOC101886296, LOC100006583, LOC101885587, plekha8, onecut3, ehf, pparab, LOC103909012, ap5s1, LOC101884390, LOC103911171"
5,10,47,"hm:zewp0073, actc1a, MGC174155, si:dkey-26g8.4, zgc:174153, zgc:174855, ctslb, ctsl1b, wu:fa26c03, si:dkey-269i1.3, MGC174857, si:dkey-239j18.3, wu:fb36g12, MGC174152, LOC100536033, tagln2, apoc1l, kcnj1a.5, fn1a, apoeb, kcnj1a.3, ttna, agr2, tfa, ttnb, pitx2, cdx4, hspb1, shha, smyd1b, si:ch211-152c2.3, foxd3, LOC101885036, si:ch211-152f23.5, id3, unc45b, six7, shhb, gpr182, xbp1, pnocb, lmo4a, zic2a, fgf8a, LOC101885197, foxi1, ugt8"
6,13,35,"emilin3a, LOC100537803, lcp1, cx43, islr2, LOC100536821, crabp1b, scrt1a, fabp7b, myh7bb, slc12a3, her4.2, LOC100006062, nkx2.2a, itpk1a, dbx1b, sox1b, mcamb, foxd1l, gfap, ecscr, tbx2a, b3gnt7l, klf5b, itpk1, fezf2, pax1a, LOC100150043, lyz, ctsl.1, cryba2b, slc5a8l, zgc:162707, ret, pitx1"
7,20,27,"tnni2b.1, tpma, myog, mylpfa, tnnc2, acta1b, atp1b1b, ckmb, olig4, klhl41b, si:ch1073-110a20.1, zgc:86709, srl, dbx1a, pah, mybphb, cd63, podxl, six3b, cdh6, tp63, hmgn2, txlnbb, rbm47, LOC100536659, casz1, ntn1b"
8,14,35,"LOC100537766, msgn1, fzd8b, ta, frzb, tbx24, szl, aldh1a2, foxa3, rdh10a, LOC101886965, si:ch211-163l21.8, si:dkey-103d23.5, tbx6, cdx1a, marcksl1b, ripply1, eve1, sp5l, stm, cxcl12a, myf5, foxa2, gata5, cx43.4, akap12b, foxc1a, dynll1, tbx1, zgc:194678, si:ch211-202h22.8, LOC100332070, tmx2a, otx1b, LOC103909079"
9,3,146,"nanos3, LOC101885394, zgc:158463, dnd1, LOC101882117, zgc:77118, aplnrb, cfl1l, gmnn, si:dkey-261j4.4, si:ch211-241j12.3, gb:am422109, LOC103910762, nmnat1, gtf3ab, LOC103911058, si:rp71-45k5.2, pm20d1.1, blf, wbp1lb, ddx4, ccnb2, im:6904482, znrf2b, drl, LOC100148648, LOC101882814, LOC101885531, hel-dr5, LOC100330497, ifnlr1, exd1, sox19b, zgc:112531, si:dkeyp-98a7.5, snapc1a, ca7, si:ch211-132b12.8, zgc:153352, LOC103911445, ccnb1, cdca9, si:ch73-303b9.1, alox5b.3, foxa, gal3st3, tram1, LOC101885485, gyg1a, zgc:114123, npdc1, si:ch211-160d20.3, aqp9b, tmem150ab, kpna7, si:ch211-145c1.1, zgc:55413, zgc:174712, zgc:56231, gig2o, si:ch211-250e5.16, p4hb, im:7136940, acap3b, zgc:113293, LOC103911695, LOC100537074, her5, tbpl2, LOC100006634, si:dkeyp-46h3.8, klf17, zar1l, si:dkey-30h22.11, LOC100331689, ctdspl2b, cpeb1b, LOC103911844, si:dkey-93n13.2, zgc:113425, ccne1, LOC100149388, c17h15orf52, LOC570474, zgc:66432, grem1a, LOC100538023, LOC100537088, si:dkey-241l7.2, LOC563918, LOC100149164, LOC100538025, rnf126, si:dkey-261j4.3, sinup, sntg2, si:dkeyp-98a7.4, fam113, si:ch73-95l15.3, si:dkey-30j22.5, tdrd5, tob1a, org, rnf146, pkn1b, LOC101883616, rad21l1, LOC100002545, LOC103910255, taf4b, specc1, LOC562104, LOC797085, adck5, LOC100535504, hsd17b8, zgc:101765, LOC101882447, spint2, LOC100334925, rxfp2b, LOC101882011, p2rx4a, zcchc11, cdca7a, si:ch211-265o23.1, znf653, LOC100535338, mos, LOC100004917, LOC100538256, LOC101885302, si:ch73-116f3.3, cxcl11.8, si:zfos-452g4.1, LOC563328, tbc1d9, snx33, zar1, si:ch211-14a17.6, si:rp71-56i13.6, thop1, LOC101883310, LOC100329742, ppp1r3g, trmt6"
10,23,23,"LOC100006216, lye, LOC100334652, alas2, LOC557268, sox32, pou5f3, gsc, ripply2, calr3b, gid8b, lft2, cyp26a1, mespab, lamtor1, lft1, admp, ved, shisa2, LOC103909127, rbm38, lhx1a, jam2a"
11,15,33,"foxi3a, LOC793940, myl7, helt, rem2, si:xx-by187g17.1, gata1a, LOC101882859, LOC103910476, sst2, LOC101886565, LOC101885536, si:dkey-47k20.1, or106-5, stoml3b, LOC103911566, spryd7a, si:dkey-261e22.4, LOC100150584, LOC101885280, klhdc1, si:ch211-272h9.3, LOC101883587, b3gat2, si:ch73-7i4.2, si:dkey-251i10.2, LOC100332343, LOC101886928, zgc:66156, alox5b.2, LOC100148249, ankrd29, wu:fc46e01"
12,4,123,"LOC103911698, LOC100535592, eomesa, hsd17b12a, fam160a1, tspo, stard10, epcam, mid1ip1l, fam212aa, zgc:193711, elovl1a, mid2, tmem184a, prkcda, atp2a2a, sh3yl1, si:dkey-43p13.5, tspan15, rhpn2, rab32a, taok3a, cax1, b4galnt3b, arpp21, oclnb, gbp3, tbc1d30, si:ch1073-280h16.1, apopt1, mapre1a, aktip, elovl7a, nadka, chchd6a, gstp1, hsp90b1, enox2, cdc34a, ppap2cb, tpi1a, chmp4ba, gtf2a1, syvn1, saraf, tsc1a, si:dkey-206d17.12, crata, btr26, ctsz, snai2, ripk4, manf, spint1b, casp8, zgc:55262, tmprss4a, xpo6, sh3gl1a, tmem222b, neu3.2, mettl16, smim12, hdr, trappc6b, cbx8b, zgc:114130, mcu, cxcr4b, fkbp6, zgc:101744, rgs17, bag4, fam49bb, lztr1, stk38l, fam117ab, zgc:113070, dhrs13a.2, fam65c, acadl, tpcn2, tmem198b, kifc3, ttc13, pkma, zdhhc13, nudt8, tbc1d14, npc2, flna, eif2ak3, grk5l, rab35b, lrrc61, trim32, dnajc5ga, fbxw2, fam35a, zgc:172180, zgc:153929, hmgcs1, fam57ba, mknk1, zgc:123010, ssx2ip, ssx2ipa, si:dkey-21a6.5, use1, gkup, me3, daam1a, rab3il1, LOC559809, hps5, tgfbrap1, ly75, rnf13, smarca2, akap11, traf4b, znrf2a, LOC103909544"
13,19,29,"npb, vmhc, LOC100333762, LOC101885903, zgc:153911, yrk, soul2, LOC103910648, LOC103911186, LOC103910540, LOC799328, LOC101884113, mir23a-3, LOC100538070, LOC798181, LOC101886939, asb16, asprv1, lum, LOC100331557, LOC570106, kctd12.1, alp3, zgc:165519, LOC100329836, itgb1b.2, zgc:92249, LOC101885238, LOC100007585"
14,1,165,"ca15b, mkrn4, rbpms2b, acp5a, cldnd, zgc:113886, map1lc3c, tmem57a, ctssb.1, dab2, slc24a4a, birc5b, slc16a3, h1m, zgc:173742, LOC796580, txlng, erbb4b, si:dkey-7n6.2, si:ch1073-416j23.1, LOC100332229, LOC100536069, hsd3b7, lamp2, zgc:113424, elovl6l, josd1, fbxo32, LOC101884632, si:dkey-256h2.1, mtmr10, caprin2, zgc:162879, c1galt1a, scamp2l, hrasls, ssh3, lmnl3, LOC799656, tatdn2, asz1, chtopb, slc35a3b, col27a1a, si:ch211-147a11.3, buc, htatip2, dennd6b, LOC101883788, zfand5b, LOC100332626, senp6b, zgc:158852, si:dkey-165i8.3, slc7a14a, dennd2db, spdya, zgc:110788, zgc:56194, erap1b, tmem144b, zgc:162509, zgc:152977, wash1, st6galnac1.2, lrmp, pabpc1l, zgc:123172, si:dkey-199f5.8, map2k7, slc25a42, phlpp2, pho, rab11fip4b, LOC103908671, smim14, zgc:100951, zgc:152986, rrad, prrg4, arhgap4a, zgc:171731, phex, si:ch1073-157b13.1, armt1, hsbp1l1, rab6b, rffl, si:ch211-137a8.2, fbxo30b, bag5, fhdc3, zgc:66483, cd164, si:dkey-1b17.14, exd2, zgc:77828, dusp22a, pafah1b1b, ppifa, otud4, phka1, ankha, si:dkey-8l13.1, irs2a, zgc:162161, fbxo8, zgc:112399, LOC100536102, amacr, LOC100537720, ccdc69, si:rp71-46j2.3, arfgap3, map2k2a, parpbp, gid4, glipr2l, znf326, mpp7, hmha1b, LOC101883812, atxn7l2b, znf385c, si:ch211-122m3.1, kcns3b, lmo7b, tmem168b, acy3.1, ica1, LOC797914, orc6, LOC100151174, ppp1r15b, degs2, foxj3, lactb2, pik3cd, golga5, glis2a, tbp, sybu, galnt6, micall2a, pdik1l, sfxn3, rpusd1, bokb, lnx2b, tex2, rbm33b, usp11, LOC103911693, si:ch211-86k6.5, fjx1, si:ch211-202f5.3, ngef, si:dkey-23a23.2, cnbd1, rnf17, glulb, si:dkey-84k17.2, mapk9, podxl2, scn1a"
15,7,62,"nanog, LOC103909095, cth1, ccna1, wee2, tdrd7a, mt2, btg4, ppp4r4, ppp1r3da, slbp2, lsm14b, gdf3, map3k2, trim35-29, si:ch211-103b1.2, si:ch211-160j14.2, zglp1, zgc:111976, LOC100148757, si:ch211-157c3.4, tysnd1, LOC101884022, st8sia7.1, LOC100535691, oafa, zgc:153345, si:dkey-208k4.2, fam175b, chia.4, LOC101884614, zgc:165508, LOC100537703, wu:fd16e03, zgc:162969, sfr1, ctsba, LOC100334439, gdf9, LOC100334362, prkg1a, snx10a, si:ch73-52e5.1, LOC103908654, zgc:100911, si:dkey-21c1.4, bin1b, lrrc3, gna13a, zgc:163014, rgs14a, slc46a1, ubald2, mlycd, cyp11a1, taf5l, hid1b, LOC100331748, ranbp3a, det1, faah2b, si:dkey-77d17.6"
16,8,52,"cmlc1, nr2e3, havcr1, crygmx, filip1b, LOC101882201, si:dkey-5n18.1, LOC103911419, LOC101886161, LOC101882296, wapalb, rfesd, LOC103908804, zgc:171686, LOC101884237, LOC101882247, tecrl2b, rtn4rl2a, slc25a51a, zgc:66426, lrrc31, LOC101884305, ern1, LOC103911082, dnttip1, LOC103911525, LOC101886966, si:dkey-88n24.9, mespba, LOC101882142, LOC101885083, irf8, LOC100536487, LOC101885503, ankrd34c, si:ch211-81n22.1, cldn17, LOC101883456, LOC100536086, LOC103909937, si:dkey-102c8.3, si:ch211-119o8.4, LOC101884227, LOC100331884, zgc:92380, LOC101884335, taar1b, LOC103911040, LOC103911305, LOC103911426, LOC101882578, senp8"
17,12,43,"ns:zf-e68, krtt1c19e, cxcl14, LOC101886293, si:ch1073-340i21.3, krt96, si:ch73-23l24.1, si:rp71-81o21.2, zgc:162971, zgc:194551, LOC100003115, LOC101884933, si:dkey-49o11.1, anxa1a, si:dkey-192p21.6, ch25hl1.1, zgc:174688, tmed1a, LOC100329768, LOC103908967, si:ch211-248g20.1, LOC101882075, LOC103910577, si:ch211-203b20.7, mitfb, LOC560497, LOC103909950, dlat, LOC799204, zgc:173615, LOC100001113, sowahd, sult3st1, si:ch211-167j6.3, dnase2, akap14, LOC100537487, LOC103910833, si:ch211-284k5.2, zgc:175248, LOC101884955, LOC569661, LOC555631"
18,17,31,"ccdc15, aqp8a.1, LOC797571, LOC103908873, tph1a, agmat, mespbb, sdk1a, si:ch73-233m11.2, si:ch211-215c18.4, them4, syt15, si:dkeyp-98a7.7, prkaa2, si:dkey-171o17.8, metap2a, gbgt1l1, zgc:158847, foxq2, pnpla8, LOC101883302, mcoln2, zgc:112492, nsun6, LOC103911039, prkag3a, zgc:153760, LOC101883749, tefb, zgc:153681, si:dkey-71d15.3"
19,11,45,"uchl1, elovl7b, cldng, wu:fd44f11, zgc:64022, osbpl7, zgc:77112, bmp15, siva1, pias4b, sel1l3, LOC100332150, cyp2r1, si:ch73-93k15.2, galk1, vgll4l, ankrd22, si:dkey-226m8.9, map7, LOC101884814, LOC100332351, mapk1, fam46ba, slmapb, lhx8a, zgc:195170, phf11, cab39l1, nudt6, stx11a, fam46c, zgc:110182, tbc1d16, fam101b, LOC101882294, lpcat4, si:dkey-87o1.2, mcfd2, sun1, zgc:153258, si:ch211-102c2.7, zgc:101562, LOC100150205, sh2d5, sgta"
20,22,24,"si:dkey-175g6.2, slit1b, xrcc2, zgc:92511, LOC100334908, LOC564674, LOC103910573, LOC101882917, LOC571582, LOC101886834, zgc:195075, zc2hc1c, LOC103908893, LOC101885270, LOC103911605, gchfr, mir489, LOC100005614, LOC101884260, col9a1a, gcnt4b, si:ch211-116m6.4, LOC103911621, cul5b"
21,6,73,"LOC565781, mal, mrc1a, sv2bb, cx30.3, trim62, si:dkey-248g15.3, si:dkey-193p11.2, ccl34a.4, pcyox1, slc22a7a, LOC103909716, LOC101883021, LOC103911139, galnt12, LOC797190, LOC103908633, LOC560530, slc2a15b, LOC101883311, dicp3.3, si:dkey-59k9.3, pi15a, zgc:77358, LOC103908665, foxj1a, stk10, LOC100331690, LOC100535129, LOC100333044, colec10, LOC103911496, LOC103910975, LOC103910599, st6gal1, si:ch211-24o10.10, LOC103911343, LOC100330288, si:dkey-78l4.6, zgc:165604, ubxn2a, si:ch211-125g7.4, zgc:163143, LOC103911580, taar12g, si:dkey-46g23.5, abhd13, rbp4l, osbpl2b, LOC101882628, si:ch211-222k6.2, LOC103911333, cdyl, si:busm1-sl7.2, fip1l1a, prg4b, si:dkeyp-73d8.9, abcd3b, ssuh2.4, si:ch211-215m21.17, ext1b, rgs6, LOC101885599, LOC103911017, LOC103910923, mdh1b, LOC103909080, pitpnc1, LOC795793, LOC103910701, LOC569077, si:rp71-1g18.13, si:dkey-263f15.2"
22,18,29,"LOC100333154, tnni1b, LOC100006250, pdp1, LOC101886910, LOC100331859, LOC101884084, oxr1a, LOC101886572, aqp3b, LOC101882591, s100a11, LOC101884042, ms4a17a.10, zgc:163057, pebp4, slc25a38a, LOC101883418, LOC103910942, si:rp71-1h3.1, LOC101882497, btr25, LOC101884668, LOC103910728, si:ch73-186j5.2, zgc:173729, zgc:172116, si:dkey-14d8.1, LOC101885783"
