"cluster","cell_cluster","#cells","up_or_down","#genes","genes"
"1","0","291","up","1","Ptgds"
"2","0","291","down","80","mt-Rnr2, Malat1, Lypd1, Pgrmc1, Snap25, Nov, mt-Nd6, mt-Atp8, Supt7l, Hspa8, Ndufa4, Mt3, Olfm1, Pcsk1n, Aplp1, Eef1a2, mt-Tm, Mgp, Nnat, Scn1b, Osbpl1a, Zcchc12, Sez6, Bhlhe22, Prkcb, Slc1a3, Marcks, Cplx1, Tmsb10, Fxyd7, Sncb, Calm3, Mobp, Jph4, Efnb3, Plp1, Tubb4a, Mapre3, Hbb-bs, Slc24a2, Cadm2, Rap1gds1, Cdc42bpa, Desi1, Ptprd, Scrt1, Sez6l2, R3hdm2, Rcan2, Qdpr, Srrm2, Pdp1, Pip5k1c, Homer1, Hba-a2, Pvalb, Hlf, Vstm2l, Camk2n2, Ppp1r16b, Egr1, Diras2, Ermn, Bcas1, Hba-a1, Mag, Cryab, Klc2, Sept4, Cnp, Plekhb1, Neat1, Mal, Hbb-bt, Trf, Gatm, Rora, Mbp, Cldn11, Igf2"
"3","1","204","down","304","Ptgds, mt-Rnr2, Nrgn, mt-Rnr1, Mbp, Ywhaz, Calm3, Calm1, Snap25, Malat1, Prkcb, Calm2, Cst3, Pcsk1n, Gm24447, Apod, Arf3, Homer1, Sncb, Eef1a2, Phyhip, Ctxn1, Dlgap1, Chn1, Dclk1, Dnm1, Syn1, Camk2a, Sparc, Slc17a6, Fam81a, Stxbp1, Gm26035, Cldn11, Mobp, Nckap1, Psd, Aldoa, Cdk5r1, Agt, Fkbp1a, Trf, Slc1a2, Gm20594, Pip5k1c, Ttr, Enpp2, Fbxl16, Rnu2-10, Pgm2l1, Kalrn, Nptxr, mt-Atp8, Usmg5, Itpr1, Plp1, Prkcd, Psd3, Myt1l, Mt3, Slc17a7, Fmnl1, mt-Tm, Mef2c, Rnu5g, Tspan7, Purb, Gm22513, Gng3, Aplp1, Celf2, Mapk10, Ttc3, Gm23624, Cck, Cplx2, Kcnip2, Vstm2l, Rps8, Gas7, Sh3gl2, Atp6v1g2, Stx1a, Map2, 3110035E14Rik, Map1a, Gria2, Sh3bgrl3, Rasgef1a, Selenow, Cbx6, Mal, Sptbn2, Cyfip2, Enc1, Gm26444, Jph3, Wasf1, Camkk2, Mapre3, Dlg2, Epn1, Tmsb4x, Gm22614, Gm25106, Gatm, Add2, Tcf7l2, Thra, Fth1, Srcin1, Rab6b, Epb41l1, Spred1, Gm25890, Gm25581, Mical2, Rab6a, mt-Nd6, Mink1, Snrpn, 1110008P14Rik, Atp6v1d, R3hdm4, Cnih2, Zbtb18, 1700020I14Rik, Fxyd7, Rps29, Mpp2, Gm25682, Gm24265, Atp1a1, Plk2, Mlf2, Prkar1b, Plekhb1, Camta2, Egr1, Klc1, Nedd4l, Dmwd, Fam131a, Arf5, Ckb, Tbr1, Pacsin1, Agap2, Klc2, Syp, Dgkz, Hpcal4, Ypel3, Tcf4, Gda, Apoe, Zic1, Sept11, Sipa1l1, Baiap2, Adgrb2, Prkce, Pcdh1, Sept3, Selenop, Napb, Fam212b, Rprml, Cnp, Cadm2, Serpine2, Sv2b, R3hdm1, Tspan2, Rims1, Mmp17, Cyp46a1, Rnf187, Ap2m1, Clip3, Diras2, Trim2, Trim9, Itpka, Arhgap32, Srrm2, Ndrg1, Crim1, Gm24407, Morf4l2, Plcb1, Icam5, Scn1b, Car2, Nlk, Arpp19, Gsk3a, Qdpr, Stx1b, Rapgefl1, Lsm14b, Ncdn, Gm11353, Pum2, Ube2ql1, Tcf25, Rock2, Pitpnm2, Rbfox3, Dlgap3, Cd81, Pfn2, Ptk2b, Pde1a, Ttc9b, Camk2n1, Mog, Cabp1, Rbfox2, R3hdm2, Ppp3r1, Celf5, Dmtn, Aldh1a1, Ppp1r9b, Efhd2, Pclo, Syngr1, Clic4, Grin2a, Efnb3, Vim, Cdk17, Synpo2, Actl6b, Il33, Mag, Dtx3, Snca, Camk4, Amph, Aqp4, Neat1, Igfbp5, Gng13, Stac2, Cxcl14, Caln1, Tmem229a, Klhl2, Bin1, Adcy1, Nr4a2, Gng11, Igf2, Tsc22d1, Crym, Tnnt1, Tpm1, Syn2, Scd1, Gm22122, Satb1, Mpped1, Cmtm5, Add1, Gm26461, Ppp1r14a, Apc, Camk2g, Kcnj10, Ptpn4, Neurod6, Arc, Camkv, Rasd2, Slc12a2, Tmem184c, Nptx1, Fam163b, Tsc22d4, Ntng1, Rn7s1, Slc6a11, Gpr37, Tppp3, Cryab, Pgrmc1, Pcp4l1, Psmb4, Ugt8a, Csrp1, Resp18, Selenom, Hpca, Wfs1, Lgi3, Calb2, Ermn, Ptpn3, Gfap, Olig1, Pcp4, Rn18s-rs5"
"4","2","183","up","1","Gm24447"
"5","2","183","down","156","Rnu2-10, Gm26035, Gm22614, Gm24265, Gm23624, Camk2n1, Ppp3ca, Gm26444, Gm25106, Rnu5g, Gm22513, Gm25581, Gm25890, Gm24407, Gm42418, Gm26917, Gm23971, Gm25679, Gm25682, Gm23973, Gm25179, mt-Atp8, Gm24459, Gm22122, Apoe, Nnat, Gm24146, Scn1b, Enc1, Olfm1, mt-Tm, Ier5, Sparc, Malat1, Gabra1, Vip, Osbpl1a, mt-Tv, Egr1, Mal2, Enpp2, Aldoc, Lingo1, Mef2c, mt-Tl2, Atp1a1, Gm22249, Scd2, Satb2, Nptx1, Rn7sk, Lamp5, Nptn, Lmo4, Qk, Pcsk1n, Vsnl1, Efhd2, Satb1, Atp1b2, Lars2, Zcchc12, Aplp1, Opcml, Psd, Brinp1, Neurod6, Rn7s1, Rnd2, Mt2, Nudt4, Ptk2b, mt-Ti, Atp1a2, Arpp19, AI593442, Dkk3, Scn1a, Nrn1, Homer1, Mt3, Ndrg2, Gm26461, Tubb4a, Junb, Ndrg3, Slc6a11, Dnajb5, Clu, Atp2b2, Ccni, Fbxw7, Serpini1, Baiap2, Mt1, Nr2f2, Nme7, Dbi, Cacnb4, Rn18s-rs5, Sort1, Agt, Ngef, Plp1, Gabrb3, Fam234b, Ntm, Ppme1, Gm1821, Btbd10, Galnt9, Efnb3, Paqr9, Mapk3, Mif, Gnai2, Lrrc4c, Zbtb20, Cops3, Calb2, Strbp, S100b, Rit2, Tcf7l2, S100a1, Macf1, Lrrc17, Dtx1, Cnp, Nrsn2, Arhgap5, Bcas1, Gap43, Gstm1, Uchl1, Ahi1, 1110008P14Rik, Gfap, Cnih2, Unc13c, Tmsb10, Cryab, Mbp, Resp18, Ermn, Sept4, Gatm, Plekhb1, Lypd1, Olfr906, Hbb-bs, Pcp4, Necab2, Apod, Hbb-bt, Ntng1"
"6","3","176","up","7","Plp1, Mbp, Mobp, Mal, Cldn11, Cnp, Apod"
"7","3","176","down","433","Fth1, Camk2n1, Olfm1, Ppp3ca, Qdpr, Calm1, Trf, Calm2, Enc1, Camk2a, Gpm6a, Scd2, Chn1, Apoe, Gatm, Nrgn, Plekhb1, Ermn, Zfp365, Snap25, Cryab, Cck, Il33, Ptk2b, Mef2c, Nptx1, Tubb4a, Qk, Nptn, Lingo1, Mag, Mapk1, Nptxr, Nrn1, Ppp3r1, Bcas1, Ugt8a, Gda, Psd, Fam131a, Car2, Ndrg4, Prkce, Sept4, Mog, Tmsb4x, Ppp1r14a, Slc17a7, Neat1, Pllp, Tspan2, Fbxl16, Atp2b1, Adcy1, Gria2, Fth-ps3, Gm42418, Sorbs2, Rasgrp1, Arpp21, Zbtb18, mt-Atp8, Myrf, Baiap2, Ndrg1, Atp1a1, Sparc, Gpr37, Csrp1, Tmem88b, Malat1, Wasf1, Gjb1, Cd9, Anks1b, Plekhh1, Homer1, 2010300C02Rik, Arf3, Lmo4, Prr5l, Brinp1, Agt, Syt1, Gabra1, Fa2h, Itpr1, Hpcal4, Sv2b, Ywhag, Ttyh2, Dock10, Slain1, Rasgef1a, Gm26917, Slc12a2, Tppp3, Erbin, Syn2, Lpar1, Clstn1, Scd1, Pip4k2a, Psd3, Olig1, Trim9, Hsp90aa1, Gm22614, Ddn, Gng11, Scn1b, Plk2, Tspan7, Tpm1, Litaf, Mal2, Psat1, Khdrbs3, Dlgap1, Gm25890, Supt7l, Btbd3, Nrxn1, Hivep2, Frrs1l, Pacs2, Mkl2, Nov, S100a16, Gm26035, Prr18, Gm25106, Wnk1, Gria3, Dbi, Tmem229a, Clu, Snca, Cdk17, Aspa, Ywhaz, Prkcb, Dgkz, 3110035E14Rik, Serpinb1a, Itpka, Cnksr2, Bhlhe40, Ier5, Lrrc17, Kalrn, Rps12, Anln, Cyfip2, Gm26444, Sowaha, Cers2, Fam81a, Dlgap3, Lamp1, Ak5, Gjc3, Sox2ot, Evi2a, Stx1a, Gprc5b, Icam5, Mmd, Aplp1, Foxg1, Gabrb3, Ephx4, Trim59, Neurod2, Aldoc, Rnu2-10, Id2, Ncald, Mmp17, Fam49a, Slc44a1, Bhlhe22, Camk4, mt-Tm, Gjc2, Kcnf1, Arpp19, Actr2, R3hdm1, Cap2, Desi1, 1110008P14Rik, Sez6, Rab6b, Lhx2, Abr, Basp1, Gucy1b3, Neurod6, Cdk5r1, Pld3, Itpk1, Stum, Phldb1, Lars2, mt-Tl2, Atp2b2, Ttc9b, Grin2a, Efhd2, Ppp1r1a, Celf2, 5031439G07Rik, Rbfox1, Egr1, Lamp5, Selenop, Dnajb5, Pcsk2, Tmcc3, Sgip1, Nlk, Gm25682, Bsn, Atp2b4, Wscd1, Lypd1, Opalin, Adgrl1, Rbfox3, Chst1, Plppr4, Spg20, Tsnax, Gm24447, Camk1d, Cpne6, Nell2, Scn2a, Clic4, Nsg2, Cx3cl1, Dab1, Cacnb4, Ndrg3, Nrxn3, Gpr22, Dusp14, Gm24265, Capza2, Mef2a, Slc39a10, Arhgef25, Syt16, Kcnh7, Tspan5, Fgfr2, Grin2b, Rab6a, Agap2, Dnm1, Galnt9, Fam49b, Gnai2, Fbxw7, Rhog, Carhsp1, Dst, Kcnj3, Sub1, Dbn1, Vsnl1, Gm12346, Mir6236, Cadm2, Prdx1, Sirt2, Gm23624, Ndrg2, Tcf7l2, Kcnip2, Rn18s-rs5, Dkk3, S100b, Rdx, Kifap3, Fnbp1, Lmo3, Erc2, Gna12, Gab1, Ensa, Cplx2, Rnf130, Pde1a, Cabp1, Mib1, Hsph1, Camkk2, Pkp4, Epha4, Nbea, Npdc1, Sptan1, Sipa1l1, Fam19a1, Serpine2, Sez6l2, Cspg5, Tmbim1, Atp2a2, Snx10, Dnajb2, Josd2, Ccp110, Pip5k1a, Tacc1, Slc30a3, Tpt1-ps6, Mt2, Vip, Efnb3, Plcb1, Cd81, Sh3gl2, Ppp3cb, Npc1, Serinc5, Abi2, Dlgap4, Calb2, Jam3, Celf5, Zbtb20, Ppp2r2b, Rnd2, Ctxn1, Nacc2, Cnih2, Kcnj10, Ogfrl1, Gls, Myo6, Ngef, Cacna2d1, Cpox, Adipor2, Grin1, Nnat, Sptbn2, Atl1, Kcnh3, Kif5b, Cyp46a1, Dync1li2, Cntn2, Eid1, Epn1, Tusc3, Pip5k1c, Ap1s1, Dpp10, Gabra4, Kif5a, Nap1l5, Pgm2l1, Hpca, Satb1, Crym, Mapt, Kcnab1, Ptpn4, Endod1, Etv1, 4930402H24Rik, Tprkb, Negr1, Shank3, Actr3, Tpt1, Cd63, Otud7b, Mt1, Phf24, Htr2c, Gm22122, Sypl, Resp18, Gpr88, Atp1b2, Abat, Kifc2, Phyhip, Rnf13, Gpr158, Rgs4, Gstm1, Pla2g16, Elmod1, Cmtm5, Palm, Hepacam, Grb14, Enpp2, Slc6a9, Npy, Tmsb10, Ache, Jph3, Sox10, Ptprd, Slc6a11, Capns1, Peg3, Slc25a22, Fgf1, Taldo1, Ndn, Gsn, Degs1, Lgi3, Zcchc24, Abca2, Gprasp2, Ppp1r16b, Ctxn3, C4b, Nrsn2, Tsc22d4, Macf1, Hap1, Gfap, Slc17a6"
"8","4","60","up","21","Ramp3, Synpo2, Shox2, Prkcd, Ntng1, Ptpn4, Pcp4, Tnnt1, Tcf7l2, Amotl1, Zic1, Adarb1, Rora, Ptpn3, Pdp1, Plcb4, Ccdc136, Cit, Cplx1, Gabra4, Grm1"
"9","4","60","down","693","Rab37, Plekhg1, Lef1, Gm43398, Vav3, Nrgn, F2r, Rgs16, Atp2a2, Eps8l2, Pitpnc1, Slc6a11, Patj, Prkch, Hcn4, Abhd12b, Slc17a6, Rap1gds1, Opn3, Psd, Edil3, Kndc1, Olfm1, Kcnc2, Ildr2, Clmn, Zmat4, Rnf152, Sptbn1, Nefh, Trnp1, Elmo1, Rab3c, Tmsb4x, Cacng5, Nrip3, Zfp804a, Rgs4, Sptssb, Nsmf, Spock3, Sgpp2, Hlf, Shank3, Hpcal4, Ogfrl1, Atp6ap2, Kitl, Epn3, Tanc1, Nexn, Adarb2, Gabbr2, Vangl1, mt-Rnr2, Bok, Uchl1, Scrt1, Rasd1, Camk2a, Adgrf5, mt-Rnr1, Gpm6a, Zfhx3, Gpr153, Tunar, Ids, Tpd52l1, Slc24a2, Sh3d19, Gm13340, Fam20c, Mbp, Nov, 1810041L15Rik, Rims3, Ndrg4, Plp1, Rsrc1, Socs6, Reep2, Grm4, Lhfp, Mb21d2, Eml1, Tespa1, Gda, Camk2n1, Dlgap3, Pcp4l1, Fign, Syn2, Cpne9, Mobp, Nell1, Tiam1, Gabrd, Gad1, Hspa12a, Serpini1, Rpl41, Phactr1, Sema4g, Chrna4, Vwc2, Baiap2, Rgs8, Ldhb, Slc1a3, Nptx1, Xylt2, Kcnq3, Spock1, Cpe, Ndrg2, Ppp3ca, St3gal4, Ncdn, Lrrtm1, Atp1a2, 2010300C02Rik, Gnal, Dbndd1, Ngef, Gm26461, Ubb, Basp1, Syt7, Marcks, Syt9, Sparc, Egr1, Nrxn1, Rbms3, Rasgrp1, Ppp3r1, mt-Nd6, Rtn1, Zfp423, Ctxn1, Ctnnb1, Spock2, Gria2, 1700019D03Rik, Slc24a3, Mgst3, Megf9, Trpc3, Inpp5a, Rplp1, Hspa8, Cdk5r1, Plekha7, Cabp1, Sema5a, Vamp1, Unc5a, Aldh1a1, Atp1b2, Car7, Chml, Alcam, Kcnj10, Samd5, Sst, Camk2n2, Rn7s1, Rasgef1b, Kcnc1, Cxx1a, Btbd3, Ldha, Hcn2, Car4, Rasgrf2, Nipal2, Hsp90aa1, Tusc3, Lrtm2, Rassf3, Chchd10, Gpc1, Atp2b1, Serpine2, Prkacb, Rap1gap, Cdkl5, Slc4a4, Tspan9, Gabrb3, Snca, Ddn, Fndc4, Gad2, Cck, Rorb, Tcf4, Cnksr2, Napepld, Atp8a1, Sipa1l1, Adra1b, Creg1, Dclk1, Lrrn2, Tubb3, Mt3, Dkk3, mt-Atp8, Gpr26, Cdk17, Kcnd3, Enc1, Nptxr, Rgs7bp, Slc9a3r1, Shisa6, Cplx2, Ttll7, Nsg1, Ubc, Atp2b4, Csdc2, Slc32a1, Cpne7, Pla2g7, Homer1, Acsbg1, Fndc5, Plekhb1, Celf4, Tmem131, Slc6a17, Cyp46a1, Cacna1g, 3110035E14Rik, Galnt9, Dagla, Ick, Abca2, 6330403K07Rik, Aplp2, Rapgef4, Gatm, Thsd7a, Ywhaz, Cttnbp2, Avpi1, Gm24447, Caln1, Dnm3, Scd1, Hpca, Sestd1, Kcnip4, Tmem163, Ncald, Gdf11, Chst8, Rasgef1a, Zmiz1, mt-Tm, Pnmal2, Gm10076, Tsc22d3, Inpp5j, Plxdc1, Agt, Chst1, Sirpa, Ppp1r1a, Pld3, Ptn, Kif1a, Stmn3, Aldoc, Lmo4, Map4, Synpr, Adgra1, Fam131a, Gm11353, Sept6, Lynx1, Reps2, Gm26035, Sowaha, Rcan2, Apod, Rprml, Adgrb1, Cntn4, Nr1d2, Gm17511, Slc38a1, Tmem178, Rab6b, Fxyd6, Pgrmc1, Nacc2, Ly6h, Atpaf1, Atp1a1, AI593442, Cnr1, Eps8, Enho, Ahi1, Sacs, Mapk1, Cacnb2, Wbscr17, Kcnk3, Nrxn3, Gnao1, Tmsb10, Nmnat2, Arpp19, Etnppl, Rhob, Gm8355, Syt16, Dgkb, Prkca, Map2, Jph4, Cacng3, B230334C09Rik, Kcnj3, Atxn1, Epb41l1, Bcas1, Cntn1, Dpp6, Mast3, Fam81a, Trove2, Fryl, Cxx1b, Rit2, Foxg1, Cited2, Thra, Plppr4, Dab1, Asphd2, Slc22a17, Gm1821, Ina, Apbb2, Hspa4l, Ephx4, Stac2, Aldoa, Kcnd2, Car2, Secisbp2l, Cnp, Glo1, Tmem56, Zeb2, Gm5514, Ctif, Gm22614, Tubb4a, Pja1, Hpcal1, Pkia, Hdac9, Ptpn11, Sorbs2, Rhou, Erc2, Cadm1, Slit1, Hnrnpa3, Stxbp5, Doc2a, Lypd1, Zfp706, Prickle1, Prox1, Enpp2, Sept8, Ndufa10, Gm22513, Vstm2a, Neurl1a, Eef1a2, Arpp21, Pkig, Cldn12, Fam19a1, Dixdc1, Bdnf, Rpsa-ps2, Lmo3, Kcnv1, Kcna2, Timp3, Igfbp4, Mef2a, Rpl13-ps3, Ank1, Cct8, Nsg2, Hcn1, Atp1b1, Arhgap44, mt-Tw, B4galt5, Meis2, Actn1, Slc25a5, C1qtnf4, Rn7s2, Asb13, Pde1a, Gm25106, Gas7, Trim9, Map1a, Foxp2, Btbd10, Ndufa12, Sez6l2, Neurod2, Jam2, Gm24265, Mpped1, Sash1, Elavl2, Nol4, Mturn, Selenop, Lamp5, Clip3, Rpl19, Gabra5, Ttc9b, Sidt1, Tmem41a, Pcdh8, Enah, Mctp1, Nt5dc3, Vstm2l, Ryr2, Vip, Necab2, Rps8, Ttc19, Mmp17, Robo2, Ndn, Dlgap1, Pitpna, Mpp6, Snrpn, 9330162G02Rik, Gabarapl2, Ptprj, Atp6v1a, Sptlc2, Mef2c, Gm24407, Meg3, Map7d1, Ckmt1, Tmx4, Rps23, Tmem132a, Negr1, Slc39a10, Ttc17, Stx1a, Armcx1, Ntrk3, Raver2, Adora1, Slc23a2, Actr3, Dnajc21, Gm23624, Sncb, Fau, Fem1c, Icam5, Gm15421, Chn1, Chrm1, Shroom2, B3gat1, Epb41l3, Ywhah, Ptprf, Nlk, Ccl27a, Rpl10, Kif3c, Anxa5, Scn1a, Slc30a3, Ndufs7, Napb, Stum, Mfge8, Gabra2, Pxdn, Abat, Fgf13, Gm12643, Sept4, Dynll1, Extl2, Ppp1r9a, Atrnl1, Fez2, Mt1, Scn4b, Nfib, Clic4, Kcnj4, Hopx, Rps23-ps1, Qk, Ptgds, Cd47, Crym, Numbl, Rps10, Olfm3, Sema7a, Ncs1, Wfs1, Il1rap, Matr3, Camkv, Klhl2, Crim1, Paqr7, Sfxn5, Scn2a, Acot7, Celf5, Iqsec3, Itpka, Gm24601, Dync1i1, Adcy2, Grm5, Ano3, Brsk1, Ttr, Cpsf3, Rell2, Rps18, Fbxl16, Tmem30a, Ppm1l, Vdac2, St6galnac5, Pak6, Bod1, Grina, Penk, Rprm, L1cam, Rnf112, Atp2b2, Gucy1a3, Rusc1, Atp5d, Agap2, Zdhhc2, Ndrg1, Unc13c, Cryab, Rbfox3, Epop, Cap2, Ipcef1, 1110008P14Rik, Car10, Slc17a7, Atl1, Unc80, Adgrb2, Parm1, Map2k1, Uba1, Nrsn2, Kcnip3, Sec14l1, Tspan33, Rpl36a-ps2, Pacs2, Kcnab2, Dennd5a, Myrf, Gucy1b3, Cadps2, Fam163b, Gng11, Ppp2r5d, Lix1, Mpc1, Hap1, Ier5, Phyhip, Got1, Ogdh, Tprgl, Prkcb, Wsb2, Plcb1, Hras, Pgm2l1, Ptk2b, Arhgap33, Pcsk2, Rock2, Junb, Pnck, Rps19, Rps7, Kcnip2, Sbk1, Kif5a, Ssbp3, Kcnh3, Plk2, Arc, Tmem255a, Tac1, Neurod6, Ttyh3, Anln, Rapgefl1, Wdr6, Nxph1, Spon1, Iqsec2, Cyfip2, Crip2, Cox7a2l, Rab15, Kifc2, Nedd4, Mef2d, Syp, Bhlhe22, Hexim1, Ppp1r16b, Pantr1, Timp2, Pds5b, Nap1l1, Luzp1, Rfx3, Limd2, Atp6v1d, Ttc14, Gria1, Coro2b, Camta2, Chgb, Polr1d, Nrbp2, Fmnl1, Sptbn2, Sh3bgrl3, Igf2, Dgkz, Ccnd1, Efhd2, Gm12184, Arl3, Dlg1, Nnat, Cacnb3, Rasl10b, Fkbp4, Epha5, Zbtb18, Ankrd46, Cygb, Tspyl5, R3hdm1, Gmfb, Tmem179, Gm1673, Strn4"
